{
  "schema_version": "1.0.0",
  "problem_definition_id": "sum-two-squares-mod-four",
  "declared_domain": "number-theory",
  "originating_principal": "actor.josh_kettlewell",
  "problem": {
    "title": "No integer congruent to three modulo four is a sum of two squares",
    "informal_statement": "Show that if an integer n leaves remainder three on division by four, then n cannot be written as a sum of two integer squares.\n\nThe target is stated for every such integer, with no upper bound.",
    "problem_type": "prove",
    "tags": ["number-theory", "quadratic-residues", "unrestricted-universal-target"]
  },
  "target_claim": {
    "local_id": "three_mod_four_not_sum_of_two_squares",
    "kind": "theorem",
    "statement": "For every integer n with n = 3 (mod 4), there are no integers a and b such that n = a^2 + b^2.",
    "scope": "unrestricted_universal"
  },
  "assumption_claims": [
    {
      "local_id": "square_residues_mod_four",
      "kind": "lemma",
      "statement": "For every integer a, a^2 = 0 (mod 4) or a^2 = 1 (mod 4).",
      "scope": "unrestricted_universal"
    }
  ],
  "formalization": {
    "version": 1,
    "statement": "forall n : Integer, n mod 4 = 3 implies not exists a b : Integer, n = a * a + b * b",
    "formal_language": "typed_informal_math",
    "quantifiers": ["forall n an integer"],
    "assumption_local_ids": ["square_residues_mod_four"],
    "approval_status": "proposed"
  },
  "semantic_alignment": {
    "quantifier_mapping": [["n", "an integer congruent to three modulo four"]],
    "definition_mapping": [["n mod 4", "the least nonnegative residue of n modulo four"]],
    "assumption_delta": ["The informal statement says 'remainder three on division by four'; the formalization writes n mod 4 = 3 and adds no further hypothesis."],
    "edge_case_delta": ["Negative n are included, since the residue is taken as the least nonnegative one."],
    "strength_relation": "equivalent"
  },
  "evaluation_protocol": {
    "version": 1,
    "phase": "exploratory",
    "metrics": ["obligations_opened", "obligations_discharged"],
    "success_criteria": ["a derivation covering every integer congruent to three modulo four, not a finite sample"],
    "stopping_rules": ["stop on a checked counterexample", "stop when the open obligation set is unchanged across two review points"]
  }
}
